[{"case_id":"C01_fixture","setup":{"wavelength_nm":1064,"focal_mm":10,"na":1.2,"n_imm":1.33,"n_pix":64,"pitch_um":8,"pad":2,"beam":{"kind":"gaussian","waist_frac":0.8}},"device":null,"target":{"kind":"traps","traps":[{"id":0,"x_um":-10.3906,"y_um":0.0,"z_um":0.0,"weight":1.0,"charge":0},{"id":1,"x_um":0.0,"y_um":0.0,"z_um":0.0,"weight":1.0,"charge":0},{"id":2,"x_um":10.3906,"y_um":0.0,"z_um":0.0,"weight":1.0,"charge":0}]},"aberration":null,"methods":["M02","M04","M06"],"reference_method":"M04","budget":{"iterations":30,"time_s":null},"seed":20261028,"feedback":null,"dynamics":null,"rearrangement":null,"expect":{"efficiency":[0.3,1.0],"rel_std_pct":[0,30]}},{"case_id":"C11_fixture","setup":{"wavelength_nm":1064,"focal_mm":10,"na":1.2,"n_imm":1.33,"n_pix":64,"pitch_um":8,"pad":2,"beam":{"kind":"gaussian","waist_frac":0.8}},"device":null,"target":{"kind":"traps","traps":[{"id":0,"x_um":900.0,"y_um":0.0,"z_um":0.0,"weight":1.0,"charge":0}]},"aberration":null,"methods":["M02","M04","M06"],"reference_method":"M04","budget":{"iterations":30,"time_s":null},"seed":20261028,"feedback":null,"dynamics":null,"rearrangement":null,"expect":{"efficiency":[0.3,1.0],"rel_std_pct":[0,30]}}]